2025-10-29T22:46:04.300282	shown	celular iphone	If I had digital ingredients I'd make a bytes-salad!
2025-10-29T22:46:46.393694	rejected	celular iphone	Hmm... that doesn't sound like a recipe, but I can help with meal ideas!
2025-10-29T22:47:02.720400	shown	rice, coconut and cinamon	That doesn't seem like food, but interesting question.
2025-10-29T22:47:17.438704	shown	Frozen Coconut Yogurt with Cinnamon (0.30); Coconut Doughnuts (0.30); Mini Raspberry and Coconut Cream Tarts (0.28)	No exact match, but how about something with Frozen Coconut Yogurt with Cinnamon (0.30); Coconut Doughnuts (0.30); Mini Raspberry and Coconut Cream Tarts (0.28)?
2025-10-29T22:47:17.461353	more	rice, coconut and cinamon	No exact match, but how about something with Frozen Coconut Yogurt with Cinnamon (0.30); Coconut Doughnuts (0.30); Mini Raspberry and Coconut Cream Tarts (0.28)?
2025-10-29T22:47:26.986382	accepted	rice, coconut and cinamon	No exact match, but how about something with ?
